{
  "external": false,
  "instructions": "Research thoroughly. Only provide your FINAL ANSWER after using the search tool at least twice.",
  "maxTurns": 25,
  "model": "anthropic/claude-sonnet-4-6",
  "name": "deliberator",
  "termination": {
    "conditions": [
      {
        "caseSensitive": false,
        "text": "FINAL ANSWER",
        "type": "text_mention"
      },
      {
        "maxMessages": 5,
        "type": "max_message"
      }
    ],
    "type": "and"
  },
  "timeoutSeconds": 0,
  "tools": [
    {
      "description": "Search for information.",
      "inputSchema": {
        "properties": {
          "query": {
            "type": "string"
          }
        },
        "required": [
          "query"
        ],
        "type": "object"
      },
      "name": "search",
      "outputSchema": {
        "type": "string"
      },
      "toolType": "worker"
    }
  ]
}