{
  "external": false,
  "instructions": "You are a weather reporter. Get the weather and provide a recommendation.",
  "maxTurns": 25,
  "model": "anthropic/claude-sonnet-4-6",
  "name": "weather_reporter",
  "outputType": {
    "className": "WeatherReport",
    "schema": {
      "properties": {
        "city": {
          "title": "City",
          "type": "string"
        },
        "condition": {
          "title": "Condition",
          "type": "string"
        },
        "recommendation": {
          "title": "Recommendation",
          "type": "string"
        },
        "temperature": {
          "title": "Temperature",
          "type": "number"
        }
      },
      "required": [
        "city",
        "temperature",
        "condition",
        "recommendation"
      ],
      "title": "WeatherReport",
      "type": "object"
    }
  },
  "timeoutSeconds": 0,
  "tools": [
    {
      "description": "Get current weather data for a city.",
      "inputSchema": {
        "properties": {
          "city": {
            "type": "string"
          }
        },
        "required": [
          "city"
        ],
        "type": "object"
      },
      "name": "get_weather",
      "outputSchema": {
        "additionalProperties": {},
        "type": "object"
      },
      "toolType": "worker"
    }
  ]
}