{
  "agents": [
    {
      "external": false,
      "instructions": "You are a researcher. Given a topic, provide key facts and data points. Be thorough but concise. Output raw research findings.",
      "maxTurns": 25,
      "model": "anthropic/claude-sonnet-4-6",
      "name": "researcher",
      "timeoutSeconds": 0
    },
    {
      "external": false,
      "instructions": "You are a writer. Take research findings and write a clear, engaging article. Use headers and bullet points where appropriate.",
      "maxTurns": 25,
      "model": "anthropic/claude-sonnet-4-6",
      "name": "writer",
      "timeoutSeconds": 0
    },
    {
      "external": false,
      "instructions": "You are an editor. Review the article for clarity, grammar, and tone. Make improvements and output the final polished version.",
      "maxTurns": 25,
      "model": "anthropic/claude-sonnet-4-6",
      "name": "editor",
      "timeoutSeconds": 0
    }
  ],
  "external": false,
  "maxTurns": 25,
  "model": "anthropic/claude-sonnet-4-6",
  "name": "researcher_writer_editor",
  "strategy": "sequential",
  "timeoutSeconds": 0
}