{
  "agents": [
    {
      "external": false,
      "instructions": "You handle billing questions: balances, payments, invoices.",
      "maxTurns": 25,
      "model": "anthropic/claude-sonnet-4-6",
      "name": "billing",
      "timeoutSeconds": 0,
      "tools": [
        {
          "description": "Check the balance of a bank account.",
          "inputSchema": {
            "properties": {
              "account_id": {
                "type": "string"
              }
            },
            "required": [
              "account_id"
            ],
            "type": "object"
          },
          "name": "check_balance",
          "outputSchema": {
            "additionalProperties": {},
            "type": "object"
          },
          "toolType": "worker"
        }
      ]
    },
    {
      "external": false,
      "instructions": "You handle technical questions: order status, shipping, returns.",
      "maxTurns": 25,
      "model": "anthropic/claude-sonnet-4-6",
      "name": "technical",
      "timeoutSeconds": 0,
      "tools": [
        {
          "description": "Look up the status of an order.",
          "inputSchema": {
            "properties": {
              "order_id": {
                "type": "string"
              }
            },
            "required": [
              "order_id"
            ],
            "type": "object"
          },
          "name": "lookup_order",
          "outputSchema": {
            "additionalProperties": {},
            "type": "object"
          },
          "toolType": "worker"
        }
      ]
    },
    {
      "external": false,
      "instructions": "You handle sales questions: pricing, products, promotions.",
      "maxTurns": 25,
      "model": "anthropic/claude-sonnet-4-6",
      "name": "sales",
      "timeoutSeconds": 0,
      "tools": [
        {
          "description": "Get pricing information for a product.",
          "inputSchema": {
            "properties": {
              "product": {
                "type": "string"
              }
            },
            "required": [
              "product"
            ],
            "type": "object"
          },
          "name": "get_pricing",
          "outputSchema": {
            "additionalProperties": {},
            "type": "object"
          },
          "toolType": "worker"
        }
      ]
    }
  ],
  "external": false,
  "instructions": "Route customer requests to the right specialist: billing, technical, or sales.",
  "maxTurns": 25,
  "model": "anthropic/claude-sonnet-4-6",
  "name": "support",
  "strategy": "handoff",
  "timeoutSeconds": 0
}