{
  "external": false,
  "guardrails": [
    {
      "guardrailType": "custom",
      "maxRetries": 3,
      "name": "no_pii",
      "onFail": "retry",
      "position": "output",
      "taskName": "no_pii"
    }
  ],
  "instructions": "You are a customer support assistant. Use the available tools to answer questions about orders and customers. Always include all details from the tool results in your response.",
  "maxTurns": 25,
  "model": "anthropic/claude-sonnet-4-6",
  "name": "support_agent",
  "timeoutSeconds": 0,
  "tools": [
    {
      "description": "Look up the current status of an order.",
      "inputSchema": {
        "properties": {
          "order_id": {
            "type": "string"
          }
        },
        "required": [
          "order_id"
        ],
        "type": "object"
      },
      "name": "get_order_status",
      "outputSchema": {
        "additionalProperties": {},
        "type": "object"
      },
      "toolType": "worker"
    },
    {
      "description": "Retrieve customer details including payment info on file.",
      "inputSchema": {
        "properties": {
          "customer_id": {
            "type": "string"
          }
        },
        "required": [
          "customer_id"
        ],
        "type": "object"
      },
      "name": "get_customer_info",
      "outputSchema": {
        "additionalProperties": {},
        "type": "object"
      },
      "toolType": "worker"
    }
  ]
}