{
  "agents": [
    {
      "external": false,
      "instructions": "You are a refund specialist. Process the customer's refund request. Check eligibility, confirm the refund amount, and let them know the timeline. Be empathetic and clear. Do NOT ask follow-up questions -- just process the refund based on what the customer told you.",
      "maxTurns": 25,
      "model": "anthropic/claude-sonnet-4-6",
      "name": "refund_specialist",
      "timeoutSeconds": 0
    },
    {
      "external": false,
      "instructions": "You are a technical support specialist. Diagnose the customer's technical issue and provide clear troubleshooting steps.",
      "maxTurns": 25,
      "model": "anthropic/claude-sonnet-4-6",
      "name": "tech_support",
      "timeoutSeconds": 0
    }
  ],
  "external": false,
  "handoffs": [
    {
      "target": "refund_specialist",
      "text": "refund",
      "type": "on_text_mention"
    },
    {
      "target": "tech_support",
      "text": "technical",
      "type": "on_text_mention"
    }
  ],
  "instructions": "You are the front-line customer support agent. Triage customer requests. If the customer needs a refund, transfer to the refund specialist. If they have a technical issue, transfer to tech support. Use the transfer tools available to you to hand off the conversation.",
  "maxTurns": 3,
  "model": "anthropic/claude-sonnet-4-6",
  "name": "support",
  "strategy": "swarm",
  "timeoutSeconds": 0
}