{
  "agents": [
    {
      "agents": [
        {
          "external": false,
          "instructions": "You are a market analyst. Analyze the market size, growth rate, and key players for the given topic. Be concise (3-4 bullet points).",
          "maxTurns": 25,
          "model": "anthropic/claude-sonnet-4-6",
          "name": "market_analyst_52",
          "timeoutSeconds": 0
        },
        {
          "external": false,
          "instructions": "You are a risk analyst. Identify the top 3 risks: regulatory, technical, and competitive. Be concise.",
          "maxTurns": 25,
          "model": "anthropic/claude-sonnet-4-6",
          "name": "risk_analyst_52",
          "timeoutSeconds": 0
        }
      ],
      "external": false,
      "maxTurns": 25,
      "model": "anthropic/claude-sonnet-4-6",
      "name": "research_phase_52",
      "strategy": "parallel",
      "timeoutSeconds": 0
    },
    {
      "external": false,
      "instructions": "You are an executive briefing writer. Synthesize the market analysis and risk assessment into a concise executive summary (1 paragraph).",
      "maxTurns": 25,
      "model": "anthropic/claude-sonnet-4-6",
      "name": "summarizer_52",
      "timeoutSeconds": 0
    }
  ],
  "external": false,
  "maxTurns": 25,
  "model": "anthropic/claude-sonnet-4-6",
  "name": "research_phase_52_summarizer_52",
  "strategy": "sequential",
  "timeoutSeconds": 0
}