{
  "external": false,
  "instructions": "You are a project manager. Use the researcher tool to gather information and the calculate tool for math. Synthesize findings.",
  "maxTurns": 25,
  "model": "anthropic/claude-sonnet-4-6",
  "name": "manager_45",
  "timeoutSeconds": 0,
  "tools": [
    {
      "config": {
        "agentConfig": {
          "external": false,
          "instructions": "You are a research assistant. Use search_knowledge_base to find information about topics. Provide concise summaries.",
          "maxTurns": 25,
          "model": "anthropic/claude-sonnet-4-6",
          "name": "researcher_45",
          "timeoutSeconds": 0,
          "tools": [
            {
              "description": "Search an internal knowledge base for information.",
              "inputSchema": {
                "properties": {
                  "query": {
                    "type": "string"
                  }
                },
                "required": [
                  "query"
                ],
                "type": "object"
              },
              "name": "search_knowledge_base",
              "outputSchema": {
                "additionalProperties": {},
                "type": "object"
              },
              "toolType": "worker"
            }
          ]
        }
      },
      "description": "Invoke the researcher_45 agent",
      "inputSchema": {
        "properties": {
          "request": {
            "description": "The request or question to send to this agent.",
            "type": "string"
          }
        },
        "required": [
          "request"
        ],
        "type": "object"
      },
      "name": "researcher_45",
      "toolType": "agent_tool"
    },
    {
      "description": "Evaluate a math expression safely.",
      "inputSchema": {
        "properties": {
          "expression": {
            "type": "string"
          }
        },
        "required": [
          "expression"
        ],
        "type": "object"
      },
      "name": "calculate",
      "outputSchema": {
        "additionalProperties": {},
        "type": "object"
      },
      "toolType": "worker"
    }
  ]
}